term_localName comment,http://rs.tdwg.org/dwc/terms/term_localName,rdfs_comment
latestEpochOrHighestSeries comment,http://rs.tdwg.org/dwc/terms/latestEpochOrHighestSeries,The full name of the latest possible geochronologic epoch or highest chronostratigraphic series attributable to the stratigraphic horizon from which the cataloged item was collected.
latestEraOrHighestErathem comment,http://rs.tdwg.org/dwc/terms/latestEraOrHighestErathem,The full name of the latest possible geochronologic era or highest chronostratigraphic erathem attributable to the stratigraphic horizon from which the cataloged item was collected.
latestPeriodOrHighestSystem comment,http://rs.tdwg.org/dwc/terms/latestPeriodOrHighestSystem,The full name of the latest possible geochronologic period or highest chronostratigraphic system attributable to the stratigraphic horizon from which the cataloged item was collected.
lifeStage comment,http://rs.tdwg.org/dwc/terms/lifeStage,The age class or life stage of the Organism(s) at the time the Occurrence was recorded.
lithostratigraphicTerms comment,http://rs.tdwg.org/dwc/terms/lithostratigraphicTerms,The combination of all litho-stratigraphic names for the rock from which the cataloged item was collected.
LivingSpecimen comment,http://rs.tdwg.org/dwc/terms/LivingSpecimen,A specimen that is alive.
locality comment,http://rs.tdwg.org/dwc/terms/locality,The specific description of the place.
locationAccordingTo comment,http://rs.tdwg.org/dwc/terms/locationAccordingTo,"Information about the source of this Location information. Could be a publication (gazetteer), institution, or team of individuals."
locationAttributes (deprecated) comment,http://rs.tdwg.org/dwc/terms/locationAttributes,"A list (concatenated and separated) of additional measurements, facts, characteristics, or assertions about the location."
locationID comment,http://rs.tdwg.org/dwc/terms/locationID,An identifier for the set of location information (data associated with dcterms:Location). May be a global unique identifier or an identifier specific to the data set.
locationRemarks comment,http://rs.tdwg.org/dwc/terms/locationRemarks,Comments or notes about the Location.
lowestBiostratigraphicZone comment,http://rs.tdwg.org/dwc/terms/lowestBiostratigraphicZone,The full name of the lowest possible geological biostratigraphic zone of the stratigraphic horizon from which the cataloged item was collected.
MachineObservation comment,http://rs.tdwg.org/dwc/terms/MachineObservation,An output of a machine observation process.
MaterialSample comment,http://rs.tdwg.org/dwc/terms/MaterialSample,"A physical result of a sampling (or subsampling) event. In biological collections, the material sample is typically collected, and either preserved or destructively processed."
materialSampleID comment,http://rs.tdwg.org/dwc/terms/materialSampleID,"An identifier for the MaterialSample (as opposed to a particular digital record of the material sample). In the absence of a persistent global unique identifier, construct one from a combination of identifiers in the record that will most closely make the materialSampleID globally unique."
maximumDepthInMeters comment,http://rs.tdwg.org/dwc/terms/maximumDepthInMeters,"The greater depth of a range of depth below the local surface, in meters."
maximumDistanceAboveSurfaceInMeters comment,http://rs.tdwg.org/dwc/terms/maximumDistanceAboveSurfaceInMeters,"The greater distance in a range of distance from a reference surface in the vertical direction, in meters. Use positive values for locations above the surface, negative values for locations below. If depth measures are given, the reference surface is the location given by the depth, otherwise the reference surface is the location given by the elevation."
maximumElevationInMeters comment,http://rs.tdwg.org/dwc/terms/maximumElevationInMeters,"The upper limit of the range of elevation (altitude, usually above sea level), in meters."
measurementAccuracy comment,http://rs.tdwg.org/dwc/terms/measurementAccuracy,The description of the potential error associated with the measurementValue.
measurementDeterminedBy comment,http://rs.tdwg.org/dwc/terms/measurementDeterminedBy,"A list (concatenated and separated) of names of people, groups, or organizations who determined the value of the MeasurementOrFact."
measurementDeterminedDate comment,http://rs.tdwg.org/dwc/terms/measurementDeterminedDate,The date on which the MeasurementOrFact was made.
measurementID comment,http://rs.tdwg.org/dwc/terms/measurementID,"An identifier for the MeasurementOrFact (information pertaining to measurements, facts, characteristics, or assertions). May be a global unique identifier or an identifier specific to the data set."
measurementMethod comment,http://rs.tdwg.org/dwc/terms/measurementMethod,"A description of or reference to (publication, URI) the method or protocol used to determine the measurement, fact, characteristic, or assertion."
MeasurementOrFact comment,http://rs.tdwg.org/dwc/terms/MeasurementOrFact,A measurement of or fact about an rdfs:Resource (http://www.w3.org/2000/01/rdf-schema#Resource).
measurementRemarks comment,http://rs.tdwg.org/dwc/terms/measurementRemarks,Comments or notes accompanying the MeasurementOrFact.
measurementType comment,http://rs.tdwg.org/dwc/terms/measurementType,"The nature of the measurement, fact, characteristic, or assertion."
measurementUnit comment,http://rs.tdwg.org/dwc/terms/measurementUnit,The units associated with the measurementValue.
measurementValue comment,http://rs.tdwg.org/dwc/terms/measurementValue,"The value of the measurement, fact, characteristic, or assertion."
member comment,http://rs.tdwg.org/dwc/terms/member,The full name of the lithostratigraphic member from which the cataloged item was collected.
minimumDepthInMeters comment,http://rs.tdwg.org/dwc/terms/minimumDepthInMeters,"The lesser depth of a range of depth below the local surface, in meters."
minimumDistanceAboveSurfaceInMeters comment,http://rs.tdwg.org/dwc/terms/minimumDistanceAboveSurfaceInMeters,"The lesser distance in a range of distance from a reference surface in the vertical direction, in meters. Use positive values for locations above the surface, negative values for locations below. If depth measures are given, the reference surface is the location given by the depth, otherwise the reference surface is the location given by the elevation."
minimumElevationInMeters comment,http://rs.tdwg.org/dwc/terms/minimumElevationInMeters,"The lower limit of the range of elevation (altitude, usually above sea level), in meters."
month comment,http://rs.tdwg.org/dwc/terms/month,The integer month in which the Event occurred.
municipality comment,http://rs.tdwg.org/dwc/terms/municipality,"The full, unabbreviated name of the next smaller administrative region than county (city, municipality, etc.) in which the Location occurs. Do not use this term for a nearby named place that does not contain the actual location."
nameAccordingTo comment,http://rs.tdwg.org/dwc/terms/nameAccordingTo,"The reference to the source in which the specific taxon concept circumscription is defined or implied - traditionally signified by the Latin ""sensu"" or ""sec."" (from secundum, meaning ""according to""). For taxa that result from identifications, a reference to the keys, monographs, experts and other sources should be given."
nameAccordingToID comment,http://rs.tdwg.org/dwc/terms/nameAccordingToID,An identifier for the source in which the specific taxon concept circumscription is defined or implied. See nameAccordingTo.
namePublicationID (deprecated) comment,http://rs.tdwg.org/dwc/terms/namePublicationID,A resolvable globally unique identifier for the original publication of the scientificName.
namePublishedIn comment,http://rs.tdwg.org/dwc/terms/namePublishedIn,A reference for the publication in which the scientificName was originally established under the rules of the associated nomenclaturalCode.
namePublishedInID comment,http://rs.tdwg.org/dwc/terms/namePublishedInID,An identifier for the publication in which the scientificName was originally established under the rules of the associated nomenclaturalCode.
namePublishedInYear comment,http://rs.tdwg.org/dwc/terms/namePublishedInYear,The four-digit year in which the scientificName was published.
nomenclaturalCode comment,http://rs.tdwg.org/dwc/terms/nomenclaturalCode,The nomenclatural code (or codes in the case of an ambiregnal name) under which the scientificName is constructed.
nomenclaturalStatus comment,http://rs.tdwg.org/dwc/terms/nomenclaturalStatus,The status related to the original publication of the name and its conformance to the relevant rules of nomenclature. It is based essentially on an algorithm according to the business rules of the code. It requires no taxonomic opinion.
Occurrence comment,http://rs.tdwg.org/dwc/terms/Occurrence,An existence of an Organism (sensu http://rs.tdwg.org/dwc/terms/Organism) at a particular place at a particular time.
occurrenceAttributes (deprecated) comment,http://rs.tdwg.org/dwc/terms/occurrenceAttributes,"A list (concatenated and separated) of additional measurements, facts, characteristics, or assertions about the Occurrence."
occurrenceDetails (deprecated) comment,http://rs.tdwg.org/dwc/terms/occurrenceDetails,"A reference (publication, URI) to the most detailed information available about the Occurrence."
occurrenceID comment,http://rs.tdwg.org/dwc/terms/occurrenceID,"An identifier for the Occurrence (as opposed to a particular digital record of the occurrence). In the absence of a persistent global unique identifier, construct one from a combination of identifiers in the record that will most closely make the occurrenceID globally unique."
OccurrenceMeasurement (deprecated) comment,http://rs.tdwg.org/dwc/terms/OccurrenceMeasurement,The category of information pertaining to measurements accociated with an occurrence.
occurrenceMeasurementAccuracy (deprecated) comment,http://rs.tdwg.org/dwc/terms/occurrenceMeasurementAccuracy,The description of the error associated with the occurrenceAttributeValue.
occurrenceMeasurementDeterminedBy (deprecated) comment,http://rs.tdwg.org/dwc/terms/occurrenceMeasurementDeterminedBy,The agent responsible for having determined the value of the measurement or characteristic of the occurrence.
occurrenceMeasurementDeterminedDate (deprecated) comment,http://rs.tdwg.org/dwc/terms/occurrenceMeasurementDeterminedDate,"The date on which the the measurement or characteristic of the occurrence was made. Recommended best practice is to use an encoding scheme, such as ISO 8601:2004(E)."
occurrenceMeasurementID (deprecated) comment,http://rs.tdwg.org/dwc/terms/occurrenceMeasurementID,An identifier for the occurrence attribute. May be a global unique identifier or an identifier specific to the data set.
occurrenceMeasurementRemarks (deprecated) comment,http://rs.tdwg.org/dwc/terms/occurrenceMeasurementRemarks,Comments or notes accompanying the measurement or characteristic of the occurrence.
occurrenceMeasurementType (deprecated) comment,http://rs.tdwg.org/dwc/terms/occurrenceMeasurementType,The nature of the measurement or characteristic of the occurrence. Recommended best practice is to use a controlled vocabulary.
occurrenceMeasurementUnit (deprecated) comment,http://rs.tdwg.org/dwc/terms/occurrenceMeasurementUnit,The units for the value of the measurement or characteristic of the occurrence. Recommended best practice is to use International System of Units (SI) units.
occurrenceMeasurementValue (deprecated) comment,http://rs.tdwg.org/dwc/terms/occurrenceMeasurementValue,The value of the measurement or characteristic of the occurrence.
occurrenceRemarks comment,http://rs.tdwg.org/dwc/terms/occurrenceRemarks,Comments or notes about the Occurrence.
occurrenceStatus comment,http://rs.tdwg.org/dwc/terms/occurrenceStatus,A statement about the presence or absence of a Taxon at a Location.
order comment,http://rs.tdwg.org/dwc/terms/order,The full scientific name of the order in which the taxon is classified.
Organism comment,http://rs.tdwg.org/dwc/terms/Organism,A particular organism or defined group of organisms considered to be taxonomically homogeneous.
organismID comment,http://rs.tdwg.org/dwc/terms/organismID,An identifier for the Organism instance (as opposed to a particular digital record of the Organism). May be a globally unique identifier or an identifier specific to the data set.
organismName comment,http://rs.tdwg.org/dwc/terms/organismName,A textual name or label assigned to an Organism instance.
organismQuantity comment,http://rs.tdwg.org/dwc/terms/organismQuantity,A number or enumeration value for the quantity of organisms.
organismQuantityType comment,http://rs.tdwg.org/dwc/terms/organismQuantityType,The type of quantification system used for the quantity of organisms.
organismRemarks comment,http://rs.tdwg.org/dwc/terms/organismRemarks,Comments or notes about the Organism instance.
organismScope comment,http://rs.tdwg.org/dwc/terms/organismScope,A description of the kind of Organism instance. Can be used to indicate whether the Organism instance represents a discrete organism or if it represents a particular type of aggregation.
originalNameUsage comment,http://rs.tdwg.org/dwc/terms/originalNameUsage,"The taxon name, with authorship and date information if known, as it originally appeared when first established under the rules of the associated nomenclaturalCode. The basionym (botany) or basonym (bacteriology) of the scientificName or the senior/earlier homonym for replaced names."
originalNameUsageID comment,http://rs.tdwg.org/dwc/terms/originalNameUsageID,An identifier for the name usage (documented meaning of the name according to a source) in which the terminal element of the scientificName was originally established under the rules of the associated nomenclaturalCode.
otherCatalogNumbers comment,http://rs.tdwg.org/dwc/terms/otherCatalogNumbers,"A list (concatenated and separated) of previous or alternate fully qualified catalog numbers or other human-used identifiers for the same Occurrence, whether in the current or any other data set or collection."
ownerInstitutionCode comment,http://rs.tdwg.org/dwc/terms/ownerInstitutionCode,The name (or acronym) in use by the institution having ownership of the object(s) or information referred to in the record.
parentEventID comment,http://rs.tdwg.org/dwc/terms/parentEventID,An identifier for the broader Event that groups this and potentially other Events.
parentNameUsage comment,http://rs.tdwg.org/dwc/terms/parentNameUsage,"The full name, with authorship and date information if known, of the direct, most proximate higher-rank parent taxon (in a classification) of the most specific element of the scientificName."
parentNameUsageID comment,http://rs.tdwg.org/dwc/terms/parentNameUsageID,"An identifier for the name usage (documented meaning of the name according to a source) of the direct, most proximate higher-rank parent taxon (in a classification) of the most specific element of the scientificName."
phylum comment,http://rs.tdwg.org/dwc/terms/phylum,The full scientific name of the phylum or division in which the taxon is classified.
pointRadiusSpatialFit comment,http://rs.tdwg.org/dwc/terms/pointRadiusSpatialFit,"The ratio of the area of the point-radius (decimalLatitude, decimalLongitude, coordinateUncertaintyInMeters) to the area of the true (original, or most specific) spatial representation of the Location. Legal values are 0, greater than or equal to 1, or undefined. A value of 1 is an exact match or 100% overlap. A value of 0 should be used if the given point-radius does not completely contain the original representation. The pointRadiusSpatialFit is undefined (and should be left empty) if the original representation is a point without uncertainty and the given georeference is not that same point (without uncertainty). If both the original and the given georeference are the same point, the pointRadiusSpatialFit is 1."
preparations comment,http://rs.tdwg.org/dwc/terms/preparations,A list (concatenated and separated) of preparations and preservation methods for a specimen.
PreservedSpecimen comment,http://rs.tdwg.org/dwc/terms/PreservedSpecimen,A specimen that has been preserved.
PreviousIdentifications (deprecated) comment,http://rs.tdwg.org/dwc/terms/PreviousIdentifications,A list (concatenated and separated) of previous ScientificNames to which the sample was identified.
previousIdentifications comment,http://rs.tdwg.org/dwc/terms/previousIdentifications,A list (concatenated and separated) of previous assignments of names to the Organism.
recordedBy comment,http://rs.tdwg.org/dwc/terms/recordedBy,"A list (concatenated and separated) of names of people, groups, or organizations responsible for recording the original Occurrence. The primary collector or observer, especially one who applies a personal identifier (recordNumber), should be listed first."
recordNumber comment,http://rs.tdwg.org/dwc/terms/recordNumber,"An identifier given to the Occurrence at the time it was recorded. Often serves as a link between field notes and an Occurrence record, such as a specimen collector's number."
RelatedBasisOfRecord (deprecated) comment,http://rs.tdwg.org/dwc/terms/RelatedBasisOfRecord,The nature of the related resource. Recommended best practice is to use the same controlled vocabulary as for basisOfRecord.
relatedResourceID comment,http://rs.tdwg.org/dwc/terms/relatedResourceID,"An identifier for a related resource (the object, rather than the subject of the relationship)."
relatedResourceType (deprecated) comment,http://rs.tdwg.org/dwc/terms/relatedResourceType,The type of the related resource. Recommended best practice is to use a controlled vocabulary.
relationshipAccordingTo comment,http://rs.tdwg.org/dwc/terms/relationshipAccordingTo,"The source (person, organization, publication, reference) establishing the relationship between the two resources."
relationshipEstablishedDate comment,http://rs.tdwg.org/dwc/terms/relationshipEstablishedDate,The date-time on which the relationship between the two resources was established.
relationshipOfResource comment,http://rs.tdwg.org/dwc/terms/relationshipOfResource,The relationship of the subject (identified by resourceID) to the object (identified by relatedResourceID).
relationshipRemarks comment,http://rs.tdwg.org/dwc/terms/relationshipRemarks,Comments or notes about the relationship between the two resources.
reproductiveCondition comment,http://rs.tdwg.org/dwc/terms/reproductiveCondition,The reproductive condition of the biological individual(s) represented in the Occurrence.
resourceID comment,http://rs.tdwg.org/dwc/terms/resourceID,An identifier for the resource that is the subject of the relationship.
ResourceRelationship comment,http://rs.tdwg.org/dwc/terms/ResourceRelationship,A relationship of one rdfs:Resource (http://www.w3.org/2000/01/rdf-schema#Resource) to another.
resourceRelationshipID comment,http://rs.tdwg.org/dwc/terms/resourceRelationshipID,"An identifier for an instance of relationship between one resource (the subject) and another (relatedResource, the object)."
Sample (deprecated) comment,http://rs.tdwg.org/dwc/terms/Sample,"Container class for information about the results of a sampling event (specimen, observation, etc.)"
SampleAttribute (deprecated) comment,http://rs.tdwg.org/dwc/terms/SampleAttribute,Container class for information about attributes related to a given sample.
SampleAttributeAccuracy (deprecated) comment,http://rs.tdwg.org/dwc/terms/SampleAttributeAccuracy,The description of the error associated with the SampleAttributeValue.
SampleAttributeDeterminedBy (deprecated) comment,http://rs.tdwg.org/dwc/terms/SampleAttributeDeterminedBy,The agent responsible for having determined the value of the measurement or characteristic of the sample.
SampleAttributeDeterminedDate (deprecated) comment,http://rs.tdwg.org/dwc/terms/SampleAttributeDeterminedDate,The date on which the the measurement or characteristic of the sample was made.
SampleAttributeRemarks (deprecated) comment,http://rs.tdwg.org/dwc/terms/SampleAttributeRemarks,Comments or notes accompanying the measurement or characteristic of the sample.
SampleAttributeUnit (deprecated) comment,http://rs.tdwg.org/dwc/terms/SampleAttributeUnit,The units for the value of the measurement or characteristic of the sample. Recommended best practice is to use International System of Units (SI) units.
SampleAttributeValue (deprecated) comment,http://rs.tdwg.org/dwc/terms/SampleAttributeValue,The value of the measurement or characteristic of the sample.
SampleRemarks (deprecated) comment,http://rs.tdwg.org/dwc/terms/SampleRemarks,Comments or notes about the sample or record.
sampleSizeUnit comment,http://rs.tdwg.org/dwc/terms/sampleSizeUnit,"The unit of measurement of the size (time duration, length, area, or volume) of a sample in a sampling event."
sampleSizeValue comment,http://rs.tdwg.org/dwc/terms/sampleSizeValue,"A numeric value for a measurement of the size (time duration, length, area, or volume) of a sample in a sampling event."
SamplingAttributeID (deprecated) comment,http://rs.tdwg.org/dwc/terms/SamplingAttributeID,An identifier for the sampling attribute. May be a global unique identifier or an identifier specific to the data set.
SamplingAttributeType (deprecated) comment,http://rs.tdwg.org/dwc/terms/SamplingAttributeType,The nature of the measurement or characteristic of the sample. Recommended best practice is to use a controlled vocabulary.
samplingEffort comment,http://rs.tdwg.org/dwc/terms/samplingEffort,The amount of effort expended during an Event.
SamplingEvent (deprecated) comment,http://rs.tdwg.org/dwc/terms/SamplingEvent,Container class for information about the conditions and methods of acquisition of samples.
SamplingEventAttributes (deprecated) comment,http://rs.tdwg.org/dwc/terms/SamplingEventAttributes,A list (concatenated and separated) of additional measurements or characteristics of the sampling event.
SamplingEventID (deprecated) comment,http://rs.tdwg.org/dwc/terms/SamplingEventID,An identifier for the sampling event. May be a global unique identifier or an identifier specific to the data set.
SamplingEventRemarks (deprecated) comment,http://rs.tdwg.org/dwc/terms/SamplingEventRemarks,Comments or notes about the sampling event.
SamplingLocation (deprecated) comment,http://rs.tdwg.org/dwc/terms/SamplingLocation,Container class for information about the location where a sampling event occurred.
SamplingLocationID (deprecated) comment,http://rs.tdwg.org/dwc/terms/SamplingLocationID,An identifier for the sampling location. May be a global unique identifier or an identifier specific to the data set.
SamplingLocationRemarks (deprecated) comment,http://rs.tdwg.org/dwc/terms/SamplingLocationRemarks,Comments or notes about the sampling location.
samplingProtocol comment,http://rs.tdwg.org/dwc/terms/samplingProtocol,"The names of, references to, or descriptions of the methods or protocols used during an Event."
scientificName comment,http://rs.tdwg.org/dwc/terms/scientificName,"The full scientific name, with authorship and date information if known. When forming part of an Identification, this should be the name in lowest level taxonomic rank that can be determined. This term should not contain identification qualifications, which should instead be supplied in the IdentificationQualifier term."
scientificNameAuthorship comment,http://rs.tdwg.org/dwc/terms/scientificNameAuthorship,The authorship information for the scientificName formatted according to the conventions of the applicable nomenclaturalCode.
scientificNameID comment,http://rs.tdwg.org/dwc/terms/scientificNameID,An identifier for the nomenclatural (not taxonomic) details of a scientific name.
scientificNameRank (deprecated) comment,http://rs.tdwg.org/dwc/terms/scientificNameRank,The taxonomic rank of the most specific name in the scientificName. Recommended best practice is to use a controlled vocabulary.
sex comment,http://rs.tdwg.org/dwc/terms/sex,The sex of the biological individual(s) represented in the Occurrence.
specificEpithet comment,http://rs.tdwg.org/dwc/terms/specificEpithet,The name of the first or species epithet of the scientificName.
startDayOfYear comment,http://rs.tdwg.org/dwc/terms/startDayOfYear,"The earliest integer day of the year on which the Event occurred (1 for January 1, 365 for December 31, except in a leap year, in which case it is 366)."
StartTimeOfDay (deprecated) comment,http://rs.tdwg.org/dwc/terms/StartTimeOfDay,"The time of day when the event began, expressed as decimal hours from midnight, local time."
stateProvince comment,http://rs.tdwg.org/dwc/terms/stateProvince,"The name of the next smaller administrative region than country (state, province, canton, department, region, etc.) in which the Location occurs."
subgenus comment,http://rs.tdwg.org/dwc/terms/subgenus,The full scientific name of the subgenus in which the taxon is classified. Values should include the genus to avoid homonym confusion.
Taxon comment,http://rs.tdwg.org/dwc/terms/Taxon,A group of organisms (sensu http://purl.obolibrary.org/obo/OBI_0100026) considered by taxonomists to form a homogeneous unit.
taxonAccordingTo (deprecated) comment,http://rs.tdwg.org/dwc/terms/taxonAccordingTo,"Information about the authorship of this taxon concept which uses the scientificName in their sense (secundum, sensu). Could be a publication (identification key), institution or team of individuals."
taxonAttributes (deprecated) comment,http://rs.tdwg.org/dwc/terms/taxonAttributes,"A list (concatenated and separated) of additional measurements, facts, characteristics, or assertions about the taxon."
taxonConceptID comment,http://rs.tdwg.org/dwc/terms/taxonConceptID,An identifier for the taxonomic concept to which the record refers - not for the nomenclatural details of a taxon.
