term_localName comment,http://rs.tdwg.org/dwc/terms/term_localName,rdfs_comment
acceptedNameUsage comment,http://rs.tdwg.org/dwc/terms/acceptedNameUsage,"The full name, with authorship and date information if known, of the currently valid (zoological) or accepted (botanical) taxon."
acceptedNameUsageID comment,http://rs.tdwg.org/dwc/terms/acceptedNameUsageID,An identifier for the name usage (documented meaning of the name according to a source) of the currently valid (zoological) or accepted (botanical) taxon.
acceptedScientificName (deprecated) comment,http://rs.tdwg.org/dwc/terms/acceptedScientificName,The currently valid (zoological) or accepted (botanical) name for the scientificName.
acceptedScientificNameID (deprecated) comment,http://rs.tdwg.org/dwc/terms/acceptedScientificNameID,A unique identifier for the acceptedScientificName.
AcceptedTaxon (deprecated) comment,http://rs.tdwg.org/dwc/terms/AcceptedTaxon,The currently valid (zoological) or accepted (botanical) name for the ScientificName.
AcceptedTaxonID (deprecated) comment,http://rs.tdwg.org/dwc/terms/AcceptedTaxonID,A global unique identifier for the parent to the AcceptedTaxon.
acceptedTaxonID (deprecated) comment,http://rs.tdwg.org/dwc/terms/acceptedTaxonID,An identifier for the name of the currently valid (zoological) or accepted (botanical) taxon. See acceptedTaxon.
acceptedTaxonName (deprecated) comment,http://rs.tdwg.org/dwc/terms/acceptedTaxonName,The currently valid (zoological) or accepted (botanical) name for the scientificName.
acceptedTaxonNameID (deprecated) comment,http://rs.tdwg.org/dwc/terms/acceptedTaxonNameID,A unique identifier for the acceptedTaxonName.
AccessConstraints (deprecated) comment,http://rs.tdwg.org/dwc/terms/AccessConstraints,A description of constraints on the use of the data as shared or access to further data that is not shared.
accordingTo (deprecated) comment,http://rs.tdwg.org/dwc/terms/accordingTo,Abstract term to attribute information to a source.
accuracy (deprecated) comment,http://rs.tdwg.org/dwc/terms/accuracy,Abstract term to capture error information about a measurement or fact.
associatedMedia comment,http://rs.tdwg.org/dwc/terms/associatedMedia,"A list (concatenated and separated) of identifiers (publication, global unique identifier, URI) of media associated with the Occurrence."
associatedOccurrences comment,http://rs.tdwg.org/dwc/terms/associatedOccurrences,A list (concatenated and separated) of identifiers of other Occurrence records and their associations to this Occurrence.
associatedOrganisms comment,http://rs.tdwg.org/dwc/terms/associatedOrganisms,A list (concatenated and separated) of identifiers of other Organisms and the associations of this Organism to each of them.
associatedReferences comment,http://rs.tdwg.org/dwc/terms/associatedReferences,"A list (concatenated and separated) of identifiers (publication, bibliographic reference, global unique identifier, URI) of literature associated with the Occurrence."
associatedSequences comment,http://rs.tdwg.org/dwc/terms/associatedSequences,"A list (concatenated and separated) of identifiers (publication, global unique identifier, URI) of genetic sequence information associated with the Occurrence."
associatedTaxa comment,http://rs.tdwg.org/dwc/terms/associatedTaxa,A list (concatenated and separated) of identifiers or names of taxa and the associations of this Occurrence to each of them.
basionym (deprecated) comment,http://rs.tdwg.org/dwc/terms/basionym,The basionym (botany) or basonym (bacteriology) of the scientificName.
basionymID (deprecated) comment,http://rs.tdwg.org/dwc/terms/basionymID,A unique identifier for the basionym (botany) or basonym (bacteriology) of the scientificName.
basisOfRecord comment,http://rs.tdwg.org/dwc/terms/basisOfRecord,The specific nature of the data record.
bed comment,http://rs.tdwg.org/dwc/terms/bed,The full name of the lithostratigraphic bed from which the cataloged item was collected.
behavior comment,http://rs.tdwg.org/dwc/terms/behavior,The behavior shown by the subject at the time the Occurrence was recorded.
binomial (deprecated) comment,http://rs.tdwg.org/dwc/terms/binomial,The combination of genus and first (species) epithet of the scientificName.
catalogNumber comment,http://rs.tdwg.org/dwc/terms/catalogNumber,An identifier (preferably unique) for the record within the data set or collection.
CatalogNumberNumeric (deprecated) comment,http://rs.tdwg.org/dwc/terms/CatalogNumberNumeric,"The numeric value of the catalogNumber, used to facilitate numerical sorting and searching by ranges."
class comment,http://rs.tdwg.org/dwc/terms/class,The full scientific name of the class in which the taxon is classified.
collectionCode comment,http://rs.tdwg.org/dwc/terms/collectionCode,"The name, acronym, coden, or initialism identifying the collection or data set from which the record was derived."
collectionID comment,http://rs.tdwg.org/dwc/terms/collectionID,An identifier for the collection or dataset from which the record was derived.
continent comment,http://rs.tdwg.org/dwc/terms/continent,The name of the continent in which the Location occurs.
coordinatePrecision comment,http://rs.tdwg.org/dwc/terms/coordinatePrecision,A decimal representation of the precision of the coordinates given in the decimalLatitude and decimalLongitude.
coordinateUncertaintyInMeters comment,http://rs.tdwg.org/dwc/terms/coordinateUncertaintyInMeters,"The horizontal distance (in meters) from the given decimalLatitude and decimalLongitude describing the smallest circle containing the whole of the Location. Leave the value empty if the uncertainty is unknown, cannot be estimated, or is not applicable (because there are no coordinates). Zero is not a valid value for this term."
country comment,http://rs.tdwg.org/dwc/terms/country,The name of the country or major administrative unit in which the Location occurs.
countryCode comment,http://rs.tdwg.org/dwc/terms/countryCode,The standard code for the country in which the Location occurs.
county comment,http://rs.tdwg.org/dwc/terms/county,"The full, unabbreviated name of the next smaller administrative region than stateProvince (county, shire, department, etc.) in which the Location occurs."
dataGeneralizations comment,http://rs.tdwg.org/dwc/terms/dataGeneralizations,Actions taken to make the shared data less specific or complete than in its original form. Suggests that alternative data of higher quality may be available on request.
Dataset (deprecated) comment,http://rs.tdwg.org/dwc/terms/Dataset,The category of information pertaining to a logical set of records.
datasetID comment,http://rs.tdwg.org/dwc/terms/datasetID,An identifier for the set of data. May be a global unique identifier or an identifier specific to a collection or institution.
datasetName comment,http://rs.tdwg.org/dwc/terms/datasetName,The name identifying the data set from which the record was derived.
dateIdentified comment,http://rs.tdwg.org/dwc/terms/dateIdentified,The date on which the subject was determined as representing the Taxon.
day comment,http://rs.tdwg.org/dwc/terms/day,The integer day of the month on which the Event occurred.
decimalLatitude comment,http://rs.tdwg.org/dwc/terms/decimalLatitude,"The geographic latitude (in decimal degrees, using the spatial reference system given in geodeticDatum) of the geographic center of a Location. Positive values are north of the Equator, negative values are south of it. Legal values lie between -90 and 90, inclusive."
decimalLongitude comment,http://rs.tdwg.org/dwc/terms/decimalLongitude,"The geographic longitude (in decimal degrees, using the spatial reference system given in geodeticDatum) of the geographic center of a Location. Positive values are east of the Greenwich Meridian, negative values are west of it. Legal values lie between -180 and 180, inclusive."
disposition comment,http://rs.tdwg.org/dwc/terms/disposition,The current state of a specimen with respect to the collection identified in collectionCode or collectionID.
DwCType (deprecated) comment,http://rs.tdwg.org/dwc/terms/DwCType,"The set of classes specified by the Darwin Core Type Vocabulary, used to categorize the nature or genre of the resource."
dynamicProperties comment,http://rs.tdwg.org/dwc/terms/dynamicProperties,"A list of additional measurements, facts, characteristics, or assertions about the record. Meant to provide a mechanism for structured content."
earliestAgeOrLowestStage comment,http://rs.tdwg.org/dwc/terms/earliestAgeOrLowestStage,The full name of the earliest possible geochronologic age or lowest chronostratigraphic stage attributable to the stratigraphic horizon from which the cataloged item was collected.
EarliestDateCollected (deprecated) comment,http://rs.tdwg.org/dwc/terms/EarliestDateCollected,"The earliest date-time in a period during which a event occurred. If the event is recorded as occurring at a single date-time, populate both EarliestDateCollected and LatestDateCollected with the same value. Recommended best practice is to use an encoding scheme, such as ISO 8601:2004(E)."
earliestEonOrLowestEonothem comment,http://rs.tdwg.org/dwc/terms/earliestEonOrLowestEonothem,"The full name of the earliest possible geochronologic eon or lowest chrono-stratigraphic eonothem or the informal name (""Precambrian"") attributable to the stratigraphic horizon from which the cataloged item was collected."
earliestEpochOrLowestSeries comment,http://rs.tdwg.org/dwc/terms/earliestEpochOrLowestSeries,The full name of the earliest possible geochronologic epoch or lowest chronostratigraphic series attributable to the stratigraphic horizon from which the cataloged item was collected.
earliestEraOrLowestErathem comment,http://rs.tdwg.org/dwc/terms/earliestEraOrLowestErathem,The full name of the earliest possible geochronologic era or lowest chronostratigraphic erathem attributable to the stratigraphic horizon from which the cataloged item was collected.
earliestPeriodOrLowestSystem comment,http://rs.tdwg.org/dwc/terms/earliestPeriodOrLowestSystem,The full name of the earliest possible geochronologic period or lowest chronostratigraphic system attributable to the stratigraphic horizon from which the cataloged item was collected.
endDayOfYear comment,http://rs.tdwg.org/dwc/terms/endDayOfYear,"The latest integer day of the year on which the Event occurred (1 for January 1, 365 for December 31, except in a leap year, in which case it is 366)."
EndTimeOfDay (deprecated) comment,http://rs.tdwg.org/dwc/terms/EndTimeOfDay,"The time of day when the event ended, expressed as decimal hours from midnight, local time."
establishmentMeans comment,http://rs.tdwg.org/dwc/terms/establishmentMeans,Statement about whether an organism or organisms have been introduced to a given place and time through the direct or indirect activity of modern humans.
Event comment,http://rs.tdwg.org/dwc/terms/Event,An action that occurs at some location during some time.
EventAttribute (deprecated) comment,http://rs.tdwg.org/dwc/terms/EventAttribute,Container class for information about attributes related to a given sampling event.
EventAttributeAccuracy (deprecated) comment,http://rs.tdwg.org/dwc/terms/EventAttributeAccuracy,The description of the error associated with the EventAttributeValue.
EventAttributeDeterminedBy (deprecated) comment,http://rs.tdwg.org/dwc/terms/EventAttributeDeterminedBy,The agent responsible for having determined the value of the measurement or characteristic of the sampling event.
EventAttributeDeterminedDate (deprecated) comment,http://rs.tdwg.org/dwc/terms/EventAttributeDeterminedDate,The date on which the the measurement or characteristic of the sampling event was made.
EventAttributeID (deprecated) comment,http://rs.tdwg.org/dwc/terms/EventAttributeID,An identifier for the event attribute. May be a global unique identifier or an identifier specific to the data set.
EventAttributeRemarks (deprecated) comment,http://rs.tdwg.org/dwc/terms/EventAttributeRemarks,Comments or notes accompanying the measurement or characteristic of the sampling event.
eventAttributes (deprecated) comment,http://rs.tdwg.org/dwc/terms/eventAttributes,A list (concatenated and separated) of additional measurements or characteristics of the Event.
EventAttributeType (deprecated) comment,http://rs.tdwg.org/dwc/terms/EventAttributeType,The nature of the measurement or characteristic of the sampling event. Recommended best practice is to use a controlled vocabulary.
EventAttributeUnit (deprecated) comment,http://rs.tdwg.org/dwc/terms/EventAttributeUnit,The units for the value of the measurement or characteristic of the sampling event. Recommended best practice is to use International System of Units (SI) units.
EventAttributeValue (deprecated) comment,http://rs.tdwg.org/dwc/terms/EventAttributeValue,The value of the measurement or characteristic of the sampling event.
eventDate comment,http://rs.tdwg.org/dwc/terms/eventDate,"The date-time or interval during which an Event occurred. For occurrences, this is the date-time when the event was recorded. Not suitable for a time in a geological context."
eventID comment,http://rs.tdwg.org/dwc/terms/eventID,An identifier for the set of information associated with an Event (something that occurs at a place and time). May be a global unique identifier or an identifier specific to the data set.
EventMeasurement (deprecated) comment,http://rs.tdwg.org/dwc/terms/EventMeasurement,The category of information pertaining to measurements associated with an event.
eventMeasurementAccuracy (deprecated) comment,http://rs.tdwg.org/dwc/terms/eventMeasurementAccuracy,The description of the error associated with the EventAttributeValue.
eventMeasurementDeterminedBy (deprecated) comment,http://rs.tdwg.org/dwc/terms/eventMeasurementDeterminedBy,The agent responsible for having determined the value of the measurement or characteristic of the event.
eventMeasurementDeterminedDate (deprecated) comment,http://rs.tdwg.org/dwc/terms/eventMeasurementDeterminedDate,"The date on which the the measurement or characteristic of the event was made. Recommended best practice is to use an encoding scheme, such as ISO 8601:2004(E)."
eventMeasurementID (deprecated) comment,http://rs.tdwg.org/dwc/terms/eventMeasurementID,An identifier for the event attribute. May be a global unique identifier or an identifier specific to the data set.
eventMeasurementRemarks (deprecated) comment,http://rs.tdwg.org/dwc/terms/eventMeasurementRemarks,Comments or notes accompanying the measurement or characteristic of the event.
eventMeasurementType (deprecated) comment,http://rs.tdwg.org/dwc/terms/eventMeasurementType,The nature of the measurement or characteristic of the event. Recommended best practice is to use a controlled vocabulary.
eventMeasurementUnit (deprecated) comment,http://rs.tdwg.org/dwc/terms/eventMeasurementUnit,The units for the value of the measurement or characteristic of the event. Recommended best practice is to use International System of Units (SI) units.
eventMeasurementValue (deprecated) comment,http://rs.tdwg.org/dwc/terms/eventMeasurementValue,The value of the measurement or characteristic of the event.
eventRemarks comment,http://rs.tdwg.org/dwc/terms/eventRemarks,Comments or notes about the Event.
eventTime comment,http://rs.tdwg.org/dwc/terms/eventTime,The time or interval during which an Event occurred.
family comment,http://rs.tdwg.org/dwc/terms/family,The full scientific name of the family in which the taxon is classified.
fieldNotes comment,http://rs.tdwg.org/dwc/terms/fieldNotes,"One of a) an indicator of the existence of, b) a reference to (publication, URI), or c) the text of notes taken in the field about the Event."
fieldNumber comment,http://rs.tdwg.org/dwc/terms/fieldNumber,An identifier given to the event in the field. Often serves as a link between field notes and the Event.
footprintSpatialFit comment,http://rs.tdwg.org/dwc/terms/footprintSpatialFit,"The ratio of the area of the footprint (footprintWKT) to the area of the true (original, or most specific) spatial representation of the Location. Legal values are 0, greater than or equal to 1, or undefined. A value of 1 is an exact match or 100% overlap. A value of 0 should be used if the given footprint does not completely contain the original representation. The footprintSpatialFit is undefined (and should be left empty) if the original representation is a point without uncertainty and the given georeference is not that same point (without uncertainty). If both the original and the given georeference are the same point, the footprintSpatialFit is 1."
footprintSRS comment,http://rs.tdwg.org/dwc/terms/footprintSRS,"The ellipsoid, geodetic datum, or spatial reference system (SRS) upon which the geometry given in footprintWKT is based."
footprintWKT comment,http://rs.tdwg.org/dwc/terms/footprintWKT,"A Well-Known Text (WKT) representation of the shape (footprint, geometry) that defines the Location. A Location may have both a point-radius representation (see decimalLatitude) and a footprint representation, and they may differ from each other."
formation comment,http://rs.tdwg.org/dwc/terms/formation,The full name of the lithostratigraphic formation from which the cataloged item was collected.
FossilSpecimen comment,http://rs.tdwg.org/dwc/terms/FossilSpecimen,A preserved specimen that is a fossil.
Generalizations (deprecated) comment,http://rs.tdwg.org/dwc/terms/Generalizations,Actions taken to make the data as shared less specific or complete than in its original form. Suggests that alternative data of highly quality may be available on request.
genus comment,http://rs.tdwg.org/dwc/terms/genus,The full scientific name of the genus in which the taxon is classified.
geodeticDatum comment,http://rs.tdwg.org/dwc/terms/geodeticDatum,"The ellipsoid, geodetic datum, or spatial reference system (SRS) upon which the geographic coordinates given in decimalLatitude and decimalLongitude as based."
GeologicalContext comment,http://rs.tdwg.org/dwc/terms/GeologicalContext,"Geological information, such as stratigraphy, that qualifies a region or place."
geologicalContextID comment,http://rs.tdwg.org/dwc/terms/geologicalContextID,"An identifier for the set of information associated with a GeologicalContext (the location within a geological context, such as stratigraphy). May be a global unique identifier or an identifier specific to the data set."
georeferencedBy comment,http://rs.tdwg.org/dwc/terms/georeferencedBy,"A list (concatenated and separated) of names of people, groups, or organizations who determined the georeference (spatial representation) for the Location."
georeferencedDate comment,http://rs.tdwg.org/dwc/terms/georeferencedDate,The date on which the Location was georeferenced.
georeferenceProtocol comment,http://rs.tdwg.org/dwc/terms/georeferenceProtocol,"A description or reference to the methods used to determine the spatial footprint, coordinates, and uncertainties."
georeferenceRemarks comment,http://rs.tdwg.org/dwc/terms/georeferenceRemarks,"Notes or comments about the spatial description determination, explaining assumptions made in addition or opposition to the those formalized in the method referred to in georeferenceProtocol."
georeferenceSources comment,http://rs.tdwg.org/dwc/terms/georeferenceSources,"A list (concatenated and separated) of maps, gazetteers, or other resources used to georeference the Location, described specifically enough to allow anyone in the future to use the same resources."
georeferenceVerificationStatus comment,http://rs.tdwg.org/dwc/terms/georeferenceVerificationStatus,A categorical description of the extent to which the georeference has been verified to represent the best possible spatial description for the Location of the Occurrence.
group comment,http://rs.tdwg.org/dwc/terms/group,The full name of the lithostratigraphic group from which the cataloged item was collected.
habitat comment,http://rs.tdwg.org/dwc/terms/habitat,A category or description of the habitat in which the Event occurred.
higherClassification comment,http://rs.tdwg.org/dwc/terms/higherClassification,A list (concatenated and separated) of taxa names terminating at the rank immediately superior to the taxon referenced in the taxon record.
higherGeography comment,http://rs.tdwg.org/dwc/terms/higherGeography,A list (concatenated and separated) of geographic names less specific than the information captured in the locality term.
higherGeographyID comment,http://rs.tdwg.org/dwc/terms/higherGeographyID,An identifier for the geographic region within which the Location occurred.
HigherTaxon (deprecated) comment,http://rs.tdwg.org/dwc/terms/HigherTaxon,A list (concatenated and separated) of the names for the taxonomic ranks less specific than the ScientificName.
higherTaxonconceptID (deprecated) comment,http://rs.tdwg.org/dwc/terms/higherTaxonconceptID,A unique identifier for the taxon concept less specific than that given in the taxonConceptID.
HigherTaxonID (deprecated) comment,http://rs.tdwg.org/dwc/terms/HigherTaxonID,A global unique identifier for the parent to the taxon.
higherTaxonName (deprecated) comment,http://rs.tdwg.org/dwc/terms/higherTaxonName,A list (concatenated and separated) of the names for the taxonomic ranks less specific than that given in the scientificName.
higherTaxonNameID (deprecated) comment,http://rs.tdwg.org/dwc/terms/higherTaxonNameID,A unique identifier for the name of the next higher rank than the scientificName in a taxonomic classification. See higherTaxonName.
highestBiostratigraphicZone comment,http://rs.tdwg.org/dwc/terms/highestBiostratigraphicZone,The full name of the highest possible geological biostratigraphic zone of the stratigraphic horizon from which the cataloged item was collected.
HumanObservation comment,http://rs.tdwg.org/dwc/terms/HumanObservation,An output of a human observation process.
Identification comment,http://rs.tdwg.org/dwc/terms/Identification,"A taxonomic determination (e.g., the assignment to a taxon)."
identificationAttributes (deprecated) comment,http://rs.tdwg.org/dwc/terms/identificationAttributes,"A list (concatenated and separated) of additional measurements, facts, characteristics, or assertions about the Identification."
identificationID comment,http://rs.tdwg.org/dwc/terms/identificationID,An identifier for the Identification (the body of information associated with the assignment of a scientific name). May be a global unique identifier or an identifier specific to the data set.
identificationQualifier comment,http://rs.tdwg.org/dwc/terms/identificationQualifier,"A brief phrase or a standard term (""cf."", ""aff."") to express the determiner's doubts about the Identification."
identificationReferences comment,http://rs.tdwg.org/dwc/terms/identificationReferences,"A list (concatenated and separated) of references (publication, global unique identifier, URI) used in the Identification."
identificationRemarks comment,http://rs.tdwg.org/dwc/terms/identificationRemarks,Comments or notes about the Identification.
identificationVerificationStatus comment,http://rs.tdwg.org/dwc/terms/identificationVerificationStatus,A categorical indicator of the extent to which the taxonomic identification has been verified to be correct.
identifiedBy comment,http://rs.tdwg.org/dwc/terms/identifiedBy,"A list (concatenated and separated) of names of people, groups, or organizations who assigned the Taxon to the subject."
individualCount comment,http://rs.tdwg.org/dwc/terms/individualCount,The number of individuals present at the time of the Occurrence.
individualID (deprecated) comment,http://rs.tdwg.org/dwc/terms/individualID,An identifier for an individual or named group of individual organisms represented in the Occurrence. Meant to accommodate resampling of the same individual or group for monitoring purposes. May be a global unique identifier or an identifier specific to a data set.
informationWithheld comment,http://rs.tdwg.org/dwc/terms/informationWithheld,"Additional information that exists, but that has not been shared in the given record."
infraspecificEpithet comment,http://rs.tdwg.org/dwc/terms/infraspecificEpithet,"The name of the lowest or terminal infraspecific epithet of the scientificName, excluding any rank designation."
institutionCode comment,http://rs.tdwg.org/dwc/terms/institutionCode,The name (or acronym) in use by the institution having custody of the object(s) or information referred to in the record.
institutionID comment,http://rs.tdwg.org/dwc/terms/institutionID,An identifier for the institution having custody of the object(s) or information referred to in the record.
island comment,http://rs.tdwg.org/dwc/terms/island,The name of the island on or near which the Location occurs.
islandGroup comment,http://rs.tdwg.org/dwc/terms/islandGroup,The name of the island group in which the Location occurs.
kingdom comment,http://rs.tdwg.org/dwc/terms/kingdom,The full scientific name of the kingdom in which the taxon is classified.
latestAgeOrHighestStage comment,http://rs.tdwg.org/dwc/terms/latestAgeOrHighestStage,The full name of the latest possible geochronologic age or highest chronostratigraphic stage attributable to the stratigraphic horizon from which the cataloged item was collected.
LatestDateCollected (deprecated) comment,http://rs.tdwg.org/dwc/terms/LatestDateCollected,"The latest date-time in a period during which a event occurred. If the event is recorded as occurring at a single date-time, populate both EarliestDateCollected and LatestDateCollected with the same value. Recommended best practice is to use an encoding scheme, such as ISO 8601:2004(E)."
latestEonOrHighestEonothem comment,http://rs.tdwg.org/dwc/terms/latestEonOrHighestEonothem,"The full name of the latest possible geochronologic eon or highest chrono-stratigraphic eonothem or the informal name (""Precambrian"") attributable to the stratigraphic horizon from which the cataloged item was collected."
